{"age":{"basis":"public_repository_created_at","created_on":"2023-05-19"},"archived":false,"bound_memories":[{"kind":"release","occurred_at":"2026-08-12T17:12:05Z","title":"AIsketcher 0.4.0","url":"https://github.com/hyeonsangjeon/AIsketcher/releases/tag/v0.4.0"},{"kind":"pull_request","number":18,"occurred_at":"2026-08-12T17:09:50Z","title":"Reset first-use growth path for v0.4.0","url":"https://github.com/hyeonsangjeon/AIsketcher/pull/18"},{"commit":"e34c80b3fcd6","kind":"commit","occurred_at":"2026-08-12T17:09:44Z","title":"Reset first-use growth path for v0.4.0 (#18)","url":"https://github.com/hyeonsangjeon/AIsketcher/commit/e34c80b3fcd639d4294e26cd5a4623a3bdbcc465"},{"commit":"a917e3f9a57d","kind":"commit","occurred_at":"2026-07-31T00:21:39Z","title":"ci: update PyPI publish action to v1.14.2 (#17)","url":"https://github.com/hyeonsangjeon/AIsketcher/commit/a917e3f9a57d48b9a61ef71d184abc21748b6500"}],"dialogue_available":true,"job":{"basis":{"language":"Python","matched_topics":[],"rule":"bounded-language-topic-v1"},"color":"#a98ce3","key":"data_cartographer","labels":{"en":"data cartographer","ko":"데이터 지도제작자"},"prop":"ledger"},"personality":{"basis":"A public release falls within the bounded recent activity window.","key":"release_minded","labels":{"en":"release-minded maker","ko":"마감을 챙기는 제작자"},"signals":{"open_issue_count":3,"pushed_within_30_days":true,"released_within_90_days":true}},"provenance":{"build_time_llm":false,"history_available":true,"profile_rule":"rules-first-v1","repository_visibility":"public","sanitization":{"dropped_items":0,"summary":null},"unavailable_or_empty":["issues"]},"recent_concerns":[{"kind":"pull_request","number":21,"occurred_at":"2026-10-15T12:14:21Z","title":"build(deps): bump actions/upload-artifact from 7.0.1 to 7.0.2","url":"https://github.com/hyeonsangjeon/AIsketcher/pull/21"},{"kind":"pull_request","number":20,"occurred_at":"2026-10-15T12:14:08Z","title":"build(deps): bump actions/download-artifact from 8.0.1 to 8.0.2","url":"https://github.com/hyeonsangjeon/AIsketcher/pull/20"},{"kind":"pull_request","number":19,"occurred_at":"2026-09-10T12:14:57Z","title":"build(deps): bump actions/deploy-pages from 5.0.0 to 5.0.1","url":"https://github.com/hyeonsangjeon/AIsketcher/pull/19"}],"repo":{"language":"Python","name":"AIsketcher","owner":"hyeonsangjeon","slug":"aisketcher","summary":"Model-independent sketch-to-image studies: seed scouting, controlled variation, replayable manifests, and a zero-download local tour.","topics":[],"url":"https://github.com/hyeonsangjeon/AIsketcher"},"schema":"repolis.resident-profile","shared":{"city_state":{"schema":"repolis.city-state","version":1}},"version":1}
