{"age":{"basis":"public_repository_created_at","created_on":"2026-10-27"},"archived":false,"bound_memories":[{"commit":"452914f9b4e5","kind":"commit","occurred_at":"2026-10-27T10:02:12Z","title":"Restore the original purchasing prompt as the starting agent","url":"https://github.com/hyeonsangjeon/ai-genius-s6e2-demo/commit/452914f9b4e5376da7f05b2b07e2ce59bcd089eb"},{"commit":"3a2bd14f8ca7","kind":"commit","occurred_at":"2026-10-27T08:55:01Z","title":"Clarify Demo 6 preparation checks","url":"https://github.com/hyeonsangjeon/ai-genius-s6e2-demo/commit/3a2bd14f8ca793d2c7264b6c3d1f5a23f1d03cbc"}],"dialogue_available":true,"job":{"basis":{"language":"Other","matched_topics":[],"rule":"bounded-language-topic-v1"},"color":"#d7af62","key":"repo_steward","labels":{"en":"repository steward","ko":"레포 관리인"},"prop":"badge"},"personality":{"basis":"The latest public push falls within the bounded recent activity window.","key":"active_tinkerer","labels":{"en":"active tinkerer","ko":"자주 손보는 실험가"},"signals":{"open_issue_count":0,"pushed_within_30_days":true,"released_within_90_days":null}},"provenance":{"build_time_llm":false,"history_available":true,"profile_rule":"rules-first-v1","repository_visibility":"public","sanitization":{"dropped_items":0,"summary":null},"unavailable_or_empty":["issues","pull_requests","releases"]},"recent_concerns":[],"repo":{"language":"Other","name":"ai-genius-s6e2-demo","owner":"hyeonsangjeon","slug":"ai-genius-s6e2-demo","summary":"AI Genius Season 6 Episode 2: Foundry agent evaluation, observability, and optimization preparation.","topics":[],"url":"https://github.com/hyeonsangjeon/ai-genius-s6e2-demo"},"schema":"repolis.resident-profile","shared":{"city_state":{"schema":"repolis.city-state","version":1}},"version":1}
