{"age":{"basis":"public_repository_created_at","created_on":"2020-07-21"},"archived":false,"bound_memories":[{"commit":"f074c17a31bf","kind":"commit","occurred_at":"2021-05-03T12:51:24Z","title":"test","url":"https://github.com/hyeonsangjeon/competition/commit/f074c17a31bff69741ddd3ab589cee3c3ed3fe65"},{"commit":"ca1e0218318b","kind":"commit","occurred_at":"2020-07-21T02:05:23Z","title":"add","url":"https://github.com/hyeonsangjeon/competition/commit/ca1e0218318b4676f38073f160711cbf26ff4d86"}],"dialogue_available":true,"job":{"basis":{"language":"Other","matched_topics":[],"rule":"bounded-language-topic-v1"},"color":"#d7af62","key":"repo_steward","labels":{"en":"repository steward","ko":"레포 관리인"},"prop":"badge"},"personality":{"basis":"Public history contains recent bounded maintenance evidence.","key":"steady_maintainer","labels":{"en":"steady maintainer","ko":"꾸준한 유지보수자"},"signals":{"open_issue_count":0,"pushed_within_30_days":false,"released_within_90_days":null}},"provenance":{"build_time_llm":false,"history_available":true,"profile_rule":"rules-first-v1","repository_visibility":"public","sanitization":{"dropped_items":0,"summary":"empty"},"unavailable_or_empty":["issues","pull_requests","releases"]},"recent_concerns":[],"repo":{"language":"Other","name":"competition","owner":"hyeonsangjeon","slug":"competition","summary":null,"topics":[],"url":"https://github.com/hyeonsangjeon/competition"},"schema":"repolis.resident-profile","shared":{"city_state":{"schema":"repolis.city-state","version":1}},"version":1}
