{"age":{"basis":"public_repository_created_at","created_on":"2025-10-27"},"archived":false,"bound_memories":[{"commit":"5ebe05299df8","kind":"commit","occurred_at":"2025-11-03T10:05:23Z","title":"sample tutorial init add.","url":"https://github.com/hyeonsangjeon/strands-bedrock-agents-cookbook/commit/5ebe05299df8038e937ca4d24de47e43637d37b3"},{"commit":"7716c766e520","kind":"commit","occurred_at":"2025-10-28T17:42:46Z","title":"add reasoning model activation","url":"https://github.com/hyeonsangjeon/strands-bedrock-agents-cookbook/commit/7716c766e520155ca42b9cff2620850f95785be1"}],"dialogue_available":true,"job":{"basis":{"language":"Python","matched_topics":["llm","machine-learning","rag"],"rule":"bounded-language-topic-v1"},"color":"#8faef5","key":"model_smith","labels":{"en":"AI model smith","ko":"AI 모델 장인"},"prop":"orb"},"personality":{"basis":"Public history contains recent bounded maintenance evidence.","key":"steady_maintainer","labels":{"en":"steady maintainer","ko":"꾸준한 유지보수자"},"signals":{"open_issue_count":1,"pushed_within_30_days":false,"released_within_90_days":null}},"provenance":{"build_time_llm":false,"history_available":true,"profile_rule":"rules-first-v1","repository_visibility":"public","sanitization":{"dropped_items":0,"summary":null},"unavailable_or_empty":["issues","releases"]},"recent_concerns":[{"kind":"pull_request","number":1,"occurred_at":"2026-07-16T01:02:03Z","title":"feat: add Bedrock Managed Knowledge Base retrieval example","url":"https://github.com/hyeonsangjeon/strands-bedrock-agents-cookbook/pull/1"}],"repo":{"language":"Python","name":"strands-bedrock-agents-cookbook","owner":"hyeonsangjeon","slug":"strands-bedrock-agents-cookbook","summary":"A comprehensive cookbook featuring 10 practical AI agent examples using Strands Agents SDK and Amazon Bedrock","topics":["llm","machine-learning","rag"],"url":"https://github.com/hyeonsangjeon/strands-bedrock-agents-cookbook"},"schema":"repolis.resident-profile","shared":{"city_state":{"schema":"repolis.city-state","version":1}},"version":1}
