{"age":{"basis":"public_repository_created_at","created_on":"2018-09-18"},"archived":false,"bound_memories":[{"commit":"74928350c786","kind":"commit","occurred_at":"2018-09-22T05:52:45Z","title":"Update README.md","url":"https://github.com/hyeonsangjeon/python-threads-queue/commit/74928350c786fda1b56639c713d83b567c602761"},{"commit":"9073e0140212","kind":"commit","occurred_at":"2018-09-22T05:52:22Z","title":"Update README.md","url":"https://github.com/hyeonsangjeon/python-threads-queue/commit/9073e0140212911f67ccb75f0bc49ba3501b6bbf"}],"dialogue_available":true,"job":{"basis":{"language":"Python","matched_topics":[],"rule":"bounded-language-topic-v1"},"color":"#a98ce3","key":"data_cartographer","labels":{"en":"data cartographer","ko":"데이터 지도제작자"},"prop":"ledger"},"personality":{"basis":"Public history contains recent bounded maintenance evidence.","key":"steady_maintainer","labels":{"en":"steady maintainer","ko":"꾸준한 유지보수자"},"signals":{"open_issue_count":0,"pushed_within_30_days":false,"released_within_90_days":null}},"provenance":{"build_time_llm":false,"history_available":true,"profile_rule":"rules-first-v1","repository_visibility":"public","sanitization":{"dropped_items":0,"summary":null},"unavailable_or_empty":["issues","pull_requests","releases"]},"recent_concerns":[],"repo":{"language":"Python","name":"python-threads-queue","owner":"hyeonsangjeon","slug":"python-threads-queue","summary":"simple python thread queue using producer consumer pattern","topics":[],"url":"https://github.com/hyeonsangjeon/python-threads-queue"},"schema":"repolis.resident-profile","shared":{"city_state":{"schema":"repolis.city-state","version":1}},"version":1}
