{"age":{"basis":"public_repository_created_at","created_on":"2020-01-14"},"archived":false,"bound_memories":[{"commit":"b78e899129b3","kind":"commit","occurred_at":"2020-01-14T08:29:45Z","title":"Delete package-lock.json","url":"https://github.com/hyeonsangjeon/morgan-winston-dailylog/commit/b78e899129b33f8565dcbc76b3aec36e69b5271c"},{"commit":"688a4b6fec4c","kind":"commit","occurred_at":"2020-01-14T08:29:36Z","title":"Delete package.json","url":"https://github.com/hyeonsangjeon/morgan-winston-dailylog/commit/688a4b6fec4c88004898b2f504ab81b6d66ef934"}],"dialogue_available":true,"job":{"basis":{"language":"JavaScript","matched_topics":[],"rule":"bounded-language-topic-v1"},"color":"#e8a956","key":"interface_gardener","labels":{"en":"interface gardener","ko":"인터페이스 정원사"},"prop":"sprout"},"personality":{"basis":"Public history contains recent bounded maintenance evidence.","key":"steady_maintainer","labels":{"en":"steady maintainer","ko":"꾸준한 유지보수자"},"signals":{"open_issue_count":0,"pushed_within_30_days":false,"released_within_90_days":null}},"provenance":{"build_time_llm":false,"history_available":true,"profile_rule":"rules-first-v1","repository_visibility":"public","sanitization":{"dropped_items":0,"summary":"empty"},"unavailable_or_empty":["issues","pull_requests","releases"]},"recent_concerns":[],"repo":{"language":"JavaScript","name":"morgan-winston-dailylog","owner":"hyeonsangjeon","slug":"morgan-winston-dailylog","summary":null,"topics":[],"url":"https://github.com/hyeonsangjeon/morgan-winston-dailylog"},"schema":"repolis.resident-profile","shared":{"city_state":{"schema":"repolis.city-state","version":1}},"version":1}
